{
  "commands": [
    {
      "argv": [
        "init",
        "--profile",
        "software",
        "--target",
        "<project-root>"
      ],
      "exit_code": 0,
      "id": "install-software",
      "stderr": "",
      "stdout": "Initialized Köni software profile at <project-root>/.koni\nValidated software 0.6.0"
    },
    {
      "argv": [
        "validate-profile",
        "<project-root>/.koni"
      ],
      "exit_code": 0,
      "id": "compile-profile",
      "stderr": "",
      "stdout": "software 0.6.0 sha256:4e4fe7ed7c364edbf281b060dc92d235030d8a9c7e50f72ababd4de85d9062ae"
    },
    {
      "argv": [
        "init-run",
        "--root",
        "<project-root>",
        "--goal",
        "deterministic compiler parity fixture"
      ],
      "exit_code": 0,
      "id": "initialize-run",
      "stderr": "",
      "stdout": "<uuid:1>"
    },
    {
      "argv": [
        "runs",
        "--root",
        "<project-root>"
      ],
      "exit_code": 0,
      "id": "list-runs-before",
      "stderr": "",
      "stdout": {
        "created_at": "<timestamp>",
        "project_id": "<uuid:2>",
        "repository_root": "<project-root>",
        "runs": {},
        "schema_version": "1.0",
        "selected_run": null,
        "updated_at": "<timestamp>"
      }
    },
    {
      "argv": [
        "validate",
        "--root",
        "<project-root>"
      ],
      "exit_code": 0,
      "id": "validate-run",
      "stderr": "",
      "stdout": "Valid"
    },
    {
      "argv": [
        "pause-run",
        "<uuid:3>",
        "--root",
        "<project-root>"
      ],
      "exit_code": 1,
      "id": "pause-unknown-run",
      "stderr": "Error: not found: run <uuid:3>",
      "stdout": ""
    },
    {
      "argv": [
        "play-run",
        "<uuid:3>",
        "--root",
        "<project-root>"
      ],
      "exit_code": 1,
      "id": "play-unknown-run",
      "stderr": "Error: not found: run <uuid:3>",
      "stdout": ""
    },
    {
      "argv": [
        "--run",
        "<uuid:3>",
        "cockpit",
        "<project-root>",
        "--json"
      ],
      "exit_code": 1,
      "id": "cockpit-unknown-run",
      "stderr": "Error: not found: run <uuid:3>",
      "stdout": ""
    },
    {
      "argv": [
        "cargo",
        "test",
        "--locked",
        "-p",
        "koni-core",
        "--test",
        "graph_check_set",
        "selected_proof_that_is_also_a_ticket_target_compiles_once_deterministically",
        "--",
        "--exact"
      ],
      "exit_code": 0,
      "id": "compile-ticket-contract",
      "stderr": "",
      "stdout": {
        "passed": true,
        "test": "selected_proof_that_is_also_a_ticket_target_compiles_once_deterministically"
      }
    },
    {
      "argv": [
        "cargo",
        "test",
        "--locked",
        "-p",
        "koni-core",
        "--test",
        "run_lifecycle",
        "selected_run_play_pause_is_durable_across_planning_and_active_phases",
        "--",
        "--exact"
      ],
      "exit_code": 0,
      "id": "positive-run-control-contract",
      "stderr": "",
      "stdout": {
        "passed": true,
        "test": "selected_run_play_pause_is_durable_across_planning_and_active_phases"
      }
    }
  ],
  "install_tree": [
    {
      "bytes": 231,
      "normalization": "raw",
      "path": ".agents/skills/configure-koni/agents/openai.yaml",
      "sha256": "c3abb7d1dee3d28eada9f19e2d311261d72f04154337cbc0f65fe68c7f019179"
    },
    {
      "bytes": 2745,
      "normalization": "raw",
      "path": ".agents/skills/configure-koni/references/agents-and-skills.md",
      "sha256": "e396ecde64813d15e534c5ba95ea468c16dcdd01bb9bee11b3a5a93ad1b70d2e"
    },
    {
      "bytes": 8033,
      "normalization": "raw",
      "path": ".agents/skills/configure-koni/references/configuration-layers.md",
      "sha256": "5bbda44529611fc6e899899e7d5e137e40ff7df64419a6403d1c95418b49e19d"
    },
    {
      "bytes": 7791,
      "normalization": "raw",
      "path": ".agents/skills/configure-koni/references/discovery-and-approval.md",
      "sha256": "3be8c4515b6577aa10177125134ed3471896fa2969ca914768ee29375e1fde3d"
    },
    {
      "bytes": 5103,
      "normalization": "raw",
      "path": ".agents/skills/configure-koni/references/run-types.md",
      "sha256": "d97a973f84f69afeb8ba2757fb2492f0111cde089c0e0ac0ccb521be6ef48ad8"
    },
    {
      "bytes": 7788,
      "normalization": "raw",
      "path": ".agents/skills/configure-koni/SKILL.md",
      "sha256": "cedb6d1b73a6900146e1e4deb4bfaf2b43f4a1ea1d3df1bf34845187d98fef94"
    },
    {
      "bytes": 232,
      "normalization": "raw",
      "path": ".agents/skills/model-koni-work/agents/openai.yaml",
      "sha256": "e52261f24f6c70a5df7b8dcfce0854332b393b1287b922d7ee04233476d60722"
    },
    {
      "bytes": 5580,
      "normalization": "raw",
      "path": ".agents/skills/model-koni-work/references/empirical-research.md",
      "sha256": "3811dfe30192b7a774b02585bd7660f1e196630a4b00c414e667962e891d4ee0"
    },
    {
      "bytes": 10690,
      "normalization": "raw",
      "path": ".agents/skills/model-koni-work/references/execution-contracts.md",
      "sha256": "fb5387389c824682eebba24db66b4c2c3f40c6bef552064c7f72fbf0a7d9f03a"
    },
    {
      "bytes": 3958,
      "normalization": "raw",
      "path": ".agents/skills/model-koni-work/references/graph-model.md",
      "sha256": "ea1c137678a62411dec1060d12b9f2405ad381143a84b93edf945c5e123625dd"
    },
    {
      "bytes": 3420,
      "normalization": "raw",
      "path": ".agents/skills/model-koni-work/references/rules-and-tickets.md",
      "sha256": "3245ff171eebcd3beca93248e8ea2f3b8054146ffae1472aa67369a8d3b9d1f5"
    },
    {
      "bytes": 28598,
      "normalization": "raw",
      "path": ".agents/skills/model-koni-work/references/software-projects.md",
      "sha256": "18f318f9553fbe48681887fe3cf244ee30132c37aa350673dafcffa405666d8c"
    },
    {
      "bytes": 6501,
      "normalization": "raw",
      "path": ".agents/skills/model-koni-work/SKILL.md",
      "sha256": "4de20edaccf230f1391df27ac53552eacd7beeafb9bed09e4aa61f6ecbd9abe4"
    },
    {
      "bytes": 199,
      "normalization": "raw",
      "path": ".agents/skills/operate-koni/agents/openai.yaml",
      "sha256": "8a178defbf524583d0e373081070a35a748c41d0c89a99bc97d00374981663b6"
    },
    {
      "bytes": 2551,
      "normalization": "raw",
      "path": ".agents/skills/operate-koni/references/operator-surfaces.md",
      "sha256": "21718460ec3777791be6a93e26badd7d9f7ebf3d4dd6f62e33abcb9e43378347"
    },
    {
      "bytes": 3376,
      "normalization": "raw",
      "path": ".agents/skills/operate-koni/references/recovery.md",
      "sha256": "27ebbfd5bfa6061a0fdea1e98989700d76308579b4ba1a553a21ac2883a3df70"
    },
    {
      "bytes": 3402,
      "normalization": "raw",
      "path": ".agents/skills/operate-koni/references/run-lifecycle.md",
      "sha256": "41e6f7438f77c4ba7ad79828c177378af69943ad85f4c0bf80f46f1822c46da2"
    },
    {
      "bytes": 4424,
      "normalization": "raw",
      "path": ".agents/skills/operate-koni/SKILL.md",
      "sha256": "33e62b94e063b8d2c845132045f45af528b6791e42d83d8a6a5ab5c0bbb231f4"
    },
    {
      "bytes": 5424,
      "normalization": "raw",
      "path": ".koni/actions.yaml",
      "sha256": "97dc1eb8c0a6a5b244aa945b8cace8c987c9a349b688a211120e7341b2d16789"
    },
    {
      "bytes": 1685,
      "normalization": "raw",
      "path": ".koni/agents/architecture-mapper.yaml",
      "sha256": "d5aa7732dd6a7225ce2700d99682c0887d1f9739f70100a24a5896486ef6d84a"
    },
    {
      "bytes": 4900,
      "normalization": "raw",
      "path": ".koni/agents/change-designer.yaml",
      "sha256": "26d1f9748d7de327c8a554a3f7b8ad3ab65feee7adaa5bff22aed4360a9af572"
    },
    {
      "bytes": 1694,
      "normalization": "raw",
      "path": ".koni/agents/contract-designer.yaml",
      "sha256": "bc428d476ae14f15816882edcf21284253da6eb55a1c7579eea094d781314e0d"
    },
    {
      "bytes": 5562,
      "normalization": "raw",
      "path": ".koni/agents/implementer.yaml",
      "sha256": "1965fc4b5adce20f0130e1c42c21731724f5dd110bc741212abba5baad97c604"
    },
    {
      "bytes": 2269,
      "normalization": "raw",
      "path": ".koni/agents/integrator.yaml",
      "sha256": "eecb993f054397c9ea66429bd7e0022ddd0d03a91909e000f6bd4214089160fd"
    },
    {
      "bytes": 2691,
      "normalization": "raw",
      "path": ".koni/agents/lead.yaml",
      "sha256": "3759cdeee0482bbfd0017231321b589b4f52ea1668030c6e0a380d903d46f15d"
    },
    {
      "bytes": 4997,
      "normalization": "raw",
      "path": ".koni/agents/reviewer.yaml",
      "sha256": "36f1dde04c1858ab881cabfe22c6782f1af40ca7a08bcf778ccd75f1767c2a88"
    },
    {
      "bytes": 2489,
      "normalization": "raw",
      "path": ".koni/agents/risk-analyst.yaml",
      "sha256": "d8446f8c0d10fcaeb1ca4e405049af9741b5aad5c9f9517fe2e2dac2e5f765fe"
    },
    {
      "bytes": 6123,
      "normalization": "raw",
      "path": ".koni/agents/run-planner.yaml",
      "sha256": "cc87d8765596b12a822dde419792596ccacc9f031af00f0f6a93b69ba58b8c40"
    },
    {
      "bytes": 2519,
      "normalization": "raw",
      "path": ".koni/agents/verifier.yaml",
      "sha256": "699860ecd05c54d189d04350bea7ab1f048461a304ad781b8845b225259f4964"
    },
    {
      "bytes": 2333,
      "normalization": "raw",
      "path": ".koni/checks.yaml",
      "sha256": "a0c22a9f5d8d3440242a120daf28a67f60b2f8d9a47056dada4d547792c9d7cf"
    },
    {
      "bytes": 3233,
      "normalization": "raw",
      "path": ".koni/cockpit.yaml",
      "sha256": "80a6bce107b7f209578c6350ab806d878347aa00a07f619bfdd1c9749f5a26e5"
    },
    {
      "bytes": 64604,
      "normalization": "raw",
      "path": ".koni/graph.yaml",
      "sha256": "173857dfcd378b8c24097cecc3ccf23f2e4e664d0f3164cc62a7b4e1acd4b86c"
    },
    {
      "bytes": 1693,
      "normalization": "raw",